date,username,to,replies,retweets,favorites,text,geo,mentions,hashtags,id,permalink
2017-01-12 23:59:02,coindesk,,0,21,25,"The latest Bitcoin Price Index is 803.48 USD http://www.coindesk.com/price/ pic.twitter.com/ZtnPsdBowD",,,,819695213157449729,https://twitter.com/coindesk/status/819695213157449729
2017-01-12 23:00:06,coindesk,,0,9,11,"A new project that seeks to merge design aspects of the bitcoin and ethereum blockchains has raised $1m in funding http://www.coindesk.com/blockchain-angels-invest-1-million-bitcoin-ethereum-hybrid-qtum/ …",,,,819680383163920387,https://twitter.com/coindesk/status/819680383163920387
2017-01-12 22:35:29,BTCNewsletter,,0,1,2,"Top #service Former Barclays boss Antony Jenkins joins board of Blockchain https://btc.icymi.email/former-barclays-boss-antony-jenkins-joins-board-of-blockchainfintech-cryptocurrency/ … #digital #bitcoin pic.twitter.com/t4TUN3Ww2P",,,#service #digital #bitcoin,819674184901074945,https://twitter.com/BTCNewsletter/status/819674184901074945
2017-01-12 22:04:30,BTCNewsletter,,1,1,1,"New #investors BBC News - US Man Jailed over Bitcoin FRAUD PONZI SCHEME https://btc.icymi.email/bbc-news-us-man-jailed-over-bitcoin-fraud-ponzi-scheme/ … #investment #runningpic.twitter.com/dRRyNAwVNT",,,#investors #investment #runningpic,819666387450953728,https://twitter.com/BTCNewsletter/status/819666387450953728
2017-01-12 22:02:38,loomdart,mBTCPizpie,0,0,0,"500 female bitcoin accounts just disappeared, cheers smaug!",,,,819665917575565312,https://twitter.com/loomdart/status/819665917575565312
2017-01-12 21:53:08,BitcoinMagazine,,2,6,11,"Needham: @winklevoss #Bitcoin ETF Would Have Profound Impact on Price, But Approval Unlikely http://btcm.ag/etfneed @tylerwinklevosspic.twitter.com/s7QT0COk1E",,@winklevoss @tylerwinklevosspic,#Bitcoin,819663528646836229,https://twitter.com/BitcoinMagazine/status/819663528646836229
2017-01-12 21:47:08,loomdart,CollinCrypto,0,0,1,"All I read is bitcoin trade war Russia v China, and this means USA will come in soon.",,,,819662019427258368,https://twitter.com/loomdart/status/819662019427258368
2017-01-12 21:39:00,BitcoinMagazine,,0,13,15,"Bitcoin Volatility Reminds Investors About the Reality of Investing in Digital Currencies http://btcm.ag/btcvolt #bitcoin #bitcoinpricepic.twitter.com/k63dwB4Hot",,,#bitcoin #bitcoinpricepic,819659970744565760,https://twitter.com/BitcoinMagazine/status/819659970744565760
2017-01-12 21:34:55,BitcoinMagazine,,1,13,14,"Op Ed: Here’s Why the #Bitcoin Price Skyrocketed in 2016 Despite Scalability Concerns, by @kyletorpey http://btcm.ag/gp2016pr #bitcoinpricepic.twitter.com/mnNVYLIeLk",,@kyletorpey,#Bitcoin #bitcoinpricepic,819658942288719872,https://twitter.com/BitcoinMagazine/status/819658942288719872
2017-01-12 21:31:59,BitcoinMagazine,,0,15,26,"Here’s Why India’s GBMiners Mining Pool Switched to Bitcoin Unlimited http://btcm.ag/gbminbu #bitcoin #india @GBMinersPool @BitcoinUnlimitepic.twitter.com/OEcbAAXsdE",,@GBMinersPool @BitcoinUnlimitepic,#bitcoin #india,819658206104403970,https://twitter.com/BitcoinMagazine/status/819658206104403970
2017-01-12 21:27:23,BitcoinMagazine,,0,21,22,"As User Base Grows, Decentralized Bitcoin Exchange @bitsquare_ to Rebrand http://btcm.ag/btsqrb #bitcoin #crytocurrency @manfred_karrerpic.twitter.com/FIzKIifmtB",,@bitsquare_ @manfred_karrerpic,#bitcoin #crytocurrency,819657046895263744,https://twitter.com/BitcoinMagazine/status/819657046895263744
2017-01-12 21:23:26,BitcoinMagazine,,0,17,15,"Bitcoin Core 0.13.2 Release: Graceful Recovery http://btcm.ag/bc0132 #bitcoin @bitcoincoreorgpic.twitter.com/jSOU3VkFn5",,@bitcoincoreorgpic,#bitcoin,819656055890255873,https://twitter.com/BitcoinMagazine/status/819656055890255873
2017-01-12 20:43:45,coindesk,,0,5,5,"Just 7 People Complained to the CFPB About Bitcoin in 2016 http://www.coindesk.com/seven-complaints-cfpb-virtual-currency-2016/ …pic.twitter.com/wUpxDvHg9k",,,,819646066438131712,https://twitter.com/coindesk/status/819646066438131712
2017-01-12 20:34:05,BTCTN,,0,14,21,"10,000+ EU ATMs to Cash Out Bitcoin https://news.bitcoin.com/10000-eu-atms-to-cash-out-bitcoin/?utm_source=dlvr.it&utm_medium=twitter …pic.twitter.com/GL9H075tpE",,,,819643635960418304,https://twitter.com/BTCTN/status/819643635960418304
2017-01-12 20:00:02,coindesk,,1,24,19,"The latest Bitcoin Price Index is 815.30 USD http://www.coindesk.com/price/ pic.twitter.com/Yw2jeGbSO1",,,,819635068079669249,https://twitter.com/coindesk/status/819635068079669249
2017-01-12 19:54:42,TuurDemeester,,1,5,16,"Information Era trends: Hacking = to steal Transparency = to respect Vigilantism = to liberate Cryptography & Bitcoin = to discipline",,,,819633721980649476,https://twitter.com/TuurDemeester/status/819633721980649476
2017-01-12 19:26:39,loomdart,,2,0,6,"China doesn't want to destroy bitcoin, the government want to control it.",,,,819626664179142658,https://twitter.com/loomdart/status/819626664179142658
2017-01-12 17:34:53,coindesk,,0,17,13,"A Chinese Bitcoin Startup is Stopping Some its Services Due to Central Bank Concerns http://bit.ly/2iheNZn pic.twitter.com/9QQ4WZbzbk",,,,819598538703339521,https://twitter.com/coindesk/status/819598538703339521
2017-01-12 16:00:08,coindesk,,2,9,7,"FT - Bitcoin was the best performing currency of 2016 https://www.ft.com/content/2caab5d6-d741-11e6-944b-e7eb37a6aa8e … vía @FT",,@FT,,819574692415766533,https://twitter.com/coindesk/status/819574692415766533
2017-01-12 16:00:03,coindesk,,0,17,12,"The latest Bitcoin Price Index is 789.96 USD http://www.coindesk.com/price/ pic.twitter.com/f01jBQKwtL",,,,819574672039608320,https://twitter.com/coindesk/status/819574672039608320
2017-01-12 15:58:02,TuurDemeester,,4,3,3,"Bitcoin Tumbling megathread on r/darknetmarkets: ""probably the most split issue on this sub"" https://www.reddit.com/r/DarkNetMarkets/comments/5nf4qv/can_we_please_stop_ignoring_the_900_pound_pink/ …",,,,819574166206709761,https://twitter.com/TuurDemeester/status/819574166206709761
2017-01-12 15:32:40,loomdart,,4,1,4,"$BTC #Bitcoin some patterns are more obvious than others. Slightly lower low followed by full retrace. pic.twitter.com/J5tegrVAYW",,,#Bitcoin,819567779279933441,https://twitter.com/loomdart/status/819567779279933441
2017-01-12 14:33:08,BTCTN,,0,6,11,"Coincheck’s Growth Reveals Surging Japanese Bitcoin Trade https://news.bitcoin.com/coinchecks-growth-reveals-surging-japanese-bitcoin-trade/?utm_source=dlvr.it&utm_medium=twitter …pic.twitter.com/6KrPbnEFmh",,,,819552800128409602,https://twitter.com/BTCTN/status/819552800128409602
2017-01-12 14:04:31,loomdart,,1,1,2,"$BTC #Bitcoin do not expect any major moves till we have full news from chinese exchanges about the PBoC ""visits"".",,,#Bitcoin,819545595358679042,https://twitter.com/loomdart/status/819545595358679042
2017-01-12 14:00:34,coindesk,,1,7,9,"Bitcoin startup BitX has rebranded as Luno, a transition that finds it shifting focus to the European market http://www.coindesk.com/bitx-rebrands-luno-reveals-bitcoin-sandbox-project/ …",,,,819544604546580480,https://twitter.com/coindesk/status/819544604546580480
2017-01-12 13:30:26,coindesk,,0,18,18,"What Central Bank? China's Big Bitcoin Traders Are Still All-In On Bitcoin http://bit.ly/2jb2RYL pic.twitter.com/DlwwovlBQ1",,,,819537018761990144,https://twitter.com/coindesk/status/819537018761990144
2017-01-12 12:00:02,coindesk,,1,25,13,"The latest Bitcoin Price Index is 762.90 USD http://www.coindesk.com/price/ pic.twitter.com/v6W3IK5HZm",,,,819514271826669572,https://twitter.com/coindesk/status/819514271826669572
2017-01-12 11:47:56,coindesk,,0,13,9,"Why I'm Fighting The IRS's Bitcoin Privacy Invasion http://www.coindesk.com/im-fighting-irss-bitcoin-privacy-invasion/ …pic.twitter.com/ancA8yx4Dp",,,,819511225595920384,https://twitter.com/coindesk/status/819511225595920384
2017-01-12 11:20:07,BTCTN,,0,2,3,"Needham: Probability of Approval for a Bitcoin ETF ‘Very Low’ https://news.bitcoin.com/needham-probability-of-approval-for-a-bitcoin-etf-very-low/?utm_source=dlvr.it&utm_medium=twitter …pic.twitter.com/FVvAm9z8NV",,,,819504223876304896,https://twitter.com/BTCTN/status/819504223876304896
2017-01-12 10:51:00,coindesk,,6,14,12,"Bitcoin ATMs Are Being Attacked With Hammers in the US Midwest http://www.coindesk.com/bitcoin-atms-attacked-hammers-us-midwest/ …pic.twitter.com/2qcsBkimxd",,,,819496896607686656,https://twitter.com/coindesk/status/819496896607686656
2017-01-12 10:03:48,BTCNewsletter,,0,2,2,"Top #Shanghai Bitcoin Prices Fall Following Possible Chinese Regulation https://btc.icymi.email/bitcoin-prices-fall-following-possible-chinese-regulation-fintech-bitcoins/ … #Digital #investorspic.twitter.com/cw8T0JWGkr",,,#Shanghai #Digital #investorspic,819485017642569728,https://twitter.com/BTCNewsletter/status/819485017642569728
2017-01-12 09:00:21,coindesk,,0,8,4,"The former operator of the now-defunct bitcoin exchange Coin.mx has plead guilty in federal court. http://www.coindesk.com/bitcoin-exchange-operator-pleads-guilty-money-crimes/ …",,,,819469050896072706,https://twitter.com/coindesk/status/819469050896072706
2017-01-12 08:00:03,coindesk,,0,30,24,"The latest Bitcoin Price Index is 752.77 USD http://www.coindesk.com/price/ pic.twitter.com/BGtuPzPLIC",,,,819453875744862208,https://twitter.com/coindesk/status/819453875744862208
2017-01-12 06:34:18,BTCNewsletter,BBCBusiness,0,0,0,"New #management China crackdown sends Bitcoin sliding https://btc.icymi.email/china-crackdown-sends-bitcoin-sliding/ … via @BBCBusiness #Digitalpic.twitter.com/cmDWhZNgqE",,@BBCBusiness,#management #Digitalpic,819432296482795522,https://twitter.com/BTCNewsletter/status/819432296482795522
2017-01-12 06:09:03,iamjosephyoung,barrysilbert,0,0,1,"Did not realize fax machines were still being manufactured #bitcoin https://twitter.com/barrysilbert/status/819364215211360261 …",,,#bitcoin,819425943483609089,https://twitter.com/iamjosephyoung/status/819425943483609089
2017-01-12 06:04:13,BTCNewsletter,bitcoinagile,0,0,0,"Top #exchanges China crackdown sends bitcoin sliding - BBC News https://btc.icymi.email/china-crackdown-sends-bitcoin-sliding-bbc-news/ … via @bitcoinagile #Digitalpic.twitter.com/IWvU6Yx2D9",,@bitcoinagile,#exchanges #Digitalpic,819424726380609536,https://twitter.com/BTCNewsletter/status/819424726380609536
2017-01-12 04:00:03,coindesk,,1,21,17,"The latest Bitcoin Price Index is 773.49 USD http://www.coindesk.com/price/ pic.twitter.com/h5xRQ2TFDe",,,,819393478220251136,https://twitter.com/coindesk/status/819393478220251136
2017-01-12 03:00:31,coindesk,,1,11,16,"Bitcoin prices tumbled more than 10% in morning trading, dipping below the $800 mark http://bit.ly/2j60KVG",,,,819378495868506112,https://twitter.com/coindesk/status/819378495868506112
2017-01-12 02:34:03,BTCNewsletter,YahooFinance,1,0,2,"Top #exchanges Bitcoin is getting demolished https://btc.icymi.email/bitcoin-is-getting-demolished/ … via @YahooFinance #investorspic.twitter.com/6o8NusMyW6",,@YahooFinance,#exchanges #investorspic,819371834986610689,https://twitter.com/BTCNewsletter/status/819371834986610689
2017-01-12 01:00:23,coindesk,,0,7,9,"“Bitcoin: 2016 in Review” by @lopphttp://bit.ly/2j23C5F",,@lopphttp,,819348265078583296,https://twitter.com/coindesk/status/819348265078583296
2017-01-12 00:46:29,TuurDemeester,euansanderson,1,1,4,"Exhuberance, taxi drivers and soccer moms buying bitcoin.",,,,819344764990431236,https://twitter.com/TuurDemeester/status/819344764990431236
2017-01-12 00:34:06,coindesk,,1,61,44,"Lightning Strikes: An (Early) Version of One of Bitcoin's Big Scaling Solutions is Finally Here http://bit.ly/2j2soAU pic.twitter.com/DaEfT8tgvJ",,,,819341649964892164,https://twitter.com/coindesk/status/819341649964892164
2017-01-12 00:07:53,BTCTN,,0,4,11,"Video Bounty App Vevue Ditches Ethereum to Payout in Bitcoin https://news.bitcoin.com/video-bounty-app-vevue-ditches-ethereum-to-payout-in-bitcoin/?utm_source=dlvr.it&utm_medium=twitter …pic.twitter.com/gzKAip2HeO",,,,819335051334664193,https://twitter.com/BTCTN/status/819335051334664193
